{
  "schema_version": "1.0",
  "provider": "provider-b",
  "backend": "quantum-b7",
  "generated_at": "2004-03-01T00:00:00Z",
  "valid_until": "2004-03-01T00:10:00Z",
  "nonce": "provider-b-0001",
  "capabilities": {"qubits": 84, "max_shots": 50000},
  "metrics": [
    {"name": "queue_delay", "value": 0.39, "unit": "s", "observed_at": "2004-03-01T00:00:00Z", "evidence": "modeled", "uncertainty": {"kind": "interval", "lower": 0.27, "upper": 0.58, "coverage": 0.95}},
    {"name": "two_qubit_error", "value": 0.015, "unit": "1", "observed_at": "2004-03-01T00:00:00Z", "evidence": "claimed", "uncertainty": {"kind": "interval", "lower": 0.012, "upper": 0.018, "coverage": 0.95}},
    {"name": "price_per_shot", "value": 0.0000014, "unit": "USD/shot", "observed_at": "2004-03-01T00:00:00Z", "evidence": "claimed", "uncertainty": {"kind": "interval", "lower": 0.0000014, "upper": 0.0000014, "coverage": 1.0}}
  ],
  "provenance": {"producer": "provider-b-adapter", "method": "field-map-b-v1", "source_id": "fixture-b-0001"},
  "signature": {"algorithm": "HMAC-SHA256-test-fixture", "key_id": "fixture-key", "value": "0000000000000000000000000000000000000000000000000000000000000000"}
}
